{
  "id": "smoke-kit",
  "name": "Smoke test: samples / nSet compliance",
  "style": "Test fixture: samples / nSet compliance gate. The kit slot leads; the others stay restrained",
  "defaultLengthCycles": 4,
  "slots": [
    {
      "slot": 1,
      "generator": "samples",
      "role": "kit (one-shots mixing bd/sn/hat) — indexes point into vocab",
      "vocab": [
        "bd:0",
        "bd:1",
        "sn:0",
        "hh:0",
        "hh:1",
        "perc:0"
      ]
    },
    {
      "slot": 2,
      "generator": "struct",
      "role": "hat — 16th-note feel, leaning on the offbeats"
    },
    {
      "slot": 3,
      "generator": "nsteps",
      "role": "timbre index — use only values from the allowed set (nSet)",
      "nSet": [
        0,
        2,
        7
      ]
    }
  ]
}
